{
  "required_keyword": "present",
  "dependent_required_keyword": "present, and so is what it depends on",
  "type_keyword": 3,
  "enum_keyword": "two",
  "const_keyword": "only",
  "min_length_keyword": "abc",
  "pattern_keyword": "abc",
  "minimum_keyword": 0,
  "maximum_keyword": 10,
  "exclusive_minimum_keyword": 0.5,
  "min_items_keyword": [1, 2],
  "items_keyword": [1, 2],
  "min_properties_keyword": { "a": 1, "b": 2 },
  "additional_properties_keyword": { "a": 1 },
  "property_names_keyword": { "allowed": 1 },
  "ref_keyword": "a string",
  "all_of_keyword": "ok",
  "any_of_keyword": 5,
  "one_of_keyword": 3,
  "if_then_keyword": "abcd",
  "else_keyword": 1
}
